{
  "$schema": "https://json-schema.org/draft/2020-12/schema",
  "$id": "https://beatless.local/schemas/task_contract.schema.json",
  "title": "TaskContract",
  "type": "object",
  "additionalProperties": false,
  "required": [
    "id",
    "goal",
    "editable_paths",
    "acceptance",
    "budget",
    "routing",
    "escalation"
  ],
  "properties": {
    "id": {
      "type": "string",
      "minLength": 3
    },
    "created_at": {
      "type": "string",
      "format": "date-time"
    },
    "priority": {
      "type": "string",
      "enum": [
        "p0",
        "p1",
        "p2",
        "p3"
      ]
    },
    "goal": {
      "type": "string",
      "minLength": 10
    },
    "context_refs": {
      "type": "array",
      "items": {
        "type": "string"
      }
    },
    "editable_paths": {
      "type": "array",
      "minItems": 1,
      "items": {
        "type": "string"
      }
    },
    "non_goals": {
      "type": "array",
      "items": {
        "type": "string"
      }
    },
    "acceptance": {
      "type": "object",
      "additionalProperties": false,
      "required": [
        "must_pass"
      ],
      "properties": {
        "must_pass": {
          "type": "array",
          "minItems": 1,
          "items": {
            "type": "string"
          }
        },
        "artifacts": {
          "type": "array",
          "items": {
            "type": "string"
          }
        },
        "smoke": {
          "type": "array",
          "items": {
            "type": "string"
          }
        }
      }
    },
    "routing": {
      "type": "object",
      "additionalProperties": false,
      "required": [
        "planner",
        "builder",
        "reviewer",
        "search",
        "research"
      ],
      "properties": {
        "planner": {
          "type": "string"
        },
        "builder": {
          "type": "string"
        },
        "reviewer": {
          "type": "string"
        },
        "search": {
          "type": "string"
        },
        "research": {
          "type": "string"
        }
      }
    },
    "budget": {
      "type": "object",
      "additionalProperties": false,
      "required": [
        "max_iterations",
        "max_wall_clock_minutes"
      ],
      "properties": {
        "max_iterations": {
          "type": "integer",
          "minimum": 1,
          "maximum": 200
        },
        "max_wall_clock_minutes": {
          "type": "integer",
          "minimum": 5,
          "maximum": 1440
        },
        "max_retry": {
          "type": "integer",
          "minimum": 0,
          "maximum": 20
        }
      }
    },
    "escalation": {
      "type": "array",
      "minItems": 1,
      "items": {
        "type": "string"
      }
    },
    "handoff": {
      "type": "object",
      "additionalProperties": false,
      "properties": {
        "required_files": {
          "type": "array",
          "items": {
            "type": "string"
          }
        },
        "summary_format": {
          "type": "string"
        }
      }
    }
  }
}
