{
  "id": "job-meta-harness-smoke",
  "created_at": "2026-04-05T00:00:00+08:00",
  "priority": "p2",
  "goal": "Smoke test meta-harness sidecar runner integration path.",
  "context_refs": ["docs/V3_SIDECAR_INTEGRATION.md"],
  "editable_paths": ["Beatless/docs"],
  "non_goals": ["Do not touch production secrets"],
  "acceptance": {
    "must_pass": ["test -d .", "true"],
    "artifacts": ["runtime/meta_harness/*/result.json"],
    "smoke": ["meta-harness sidecar dry-run"]
  },
  "routing": {
    "planner": "claude_architect_cli",
    "builder": "claude_build_cli",
    "reviewer": "codex_review_cli",
    "search": "search_cli",
    "research": "gemini_research_cli"
  },
  "budget": {
    "max_iterations": 2,
    "max_wall_clock_minutes": 10,
    "max_retry": 0
  },
  "escalation": ["Need elevated privileges"],
  "handoff": {
    "required_files": ["result.json"],
    "summary_format": "findings-first"
  }
}
