{
  "id": "smoke-1775546213",
  "created_at": "2026-04-04T13:39:26+08:00",
  "priority": "p1",
  "goal": "Smoke validation of Beatless Task OS W1 scheduler direct-pass mode.",
  "context_refs": [
    "docs/OPENROOM_MCP_MULTIAGENT_DESIGN.md",
    "docs/ACCEPTANCE_CHECKLIST.md"
  ],
  "editable_paths": [
    "Beatless/docs",
    "Beatless/scripts"
  ],
  "non_goals": [
    "Do not modify production secrets",
    "Do not refactor unrelated game apps"
  ],
  "acceptance": {
    "must_pass": [
      "pnpm -C OpenRoom build",
      "pnpm -C OpenRoom test",
      "curl -sf http://127.0.0.1:3000/api/openclaw-agent >/dev/null"
    ],
    "artifacts": [
      "docs/OPENROOM_MCP_MULTIAGENT_DESIGN.md",
      "reports/smoke-report.md"
    ],
    "smoke": [
      "router mode direct/hybrid switch",
      "session pager Prev/Latest/Next",
      "upload passthrough"
    ]
  },
  "routing": {
    "planner": "claude_architect_cli",
    "builder": "claude_build_cli",
    "reviewer": "codex_review_cli",
    "search": "search_cli",
    "research": "gemini_research_cli"
  },
  "budget": {
    "max_iterations": 14,
    "max_wall_clock_minutes": 480,
    "max_retry": 4
  },
  "escalation": [
    "Two repeated failures in the same stage",
    "Need elevated privileges",
    "Touches secret/auth boundaries"
  ],
  "handoff": {
    "required_files": [
      "reports/smoke-report.md",
      "reports/rollback-plan.md"
    ],
    "summary_format": "findings-first"
  }
}
